{
  "schemaVersion": "1.0",
  "layout": "docops",
  "docsRoot": "docs",
  "languages": [
    { "code": "en", "label": "English", "path": "en" }
  ],
  "primaryLanguage": "en",
  "docTypes": {
    "srs": {
      "enabled": true,
      "path": "docs/srs",
      "label": "SRS",
      "templatesPath": ".docops/templates/srs"
    }
  },
  "paths": {
    "registry": ".docops/registry",
    "comments": ".docops/comments",
    "reviewConfig": ".docops/review.config.json",
    "reviewQueue": ".docops/review-queue",
    "prototypeConfig": ".docops/prototype/config.json",
    "prototypeScreenMap": ".docops/prototype/screen-map.json"
  },
  "capabilities": {
    "review": false,
    "comments": true,
    "prototype": true,
    "graph": false,
    "generate": false,
    "translate": false
  }
}
